input_value,input_matched_alias,entity_id,pathway_id,pathway_description,pathway_source_system,pathway_data_source,pathway_etl_package_id,entity_relationships_by_group,total_entity_relationships,other_aliases,status,note
R-HSA-9675135,R-HSA-9675135,126738,R-HSA-9675135,Diseases of DNA repair,Reactome,reactome,,,,['Diseases of DNA repair'],ok,
R-HSA-5260271,R-HSA-5260271,126739,R-HSA-5260271,Diseases of Immune System,Reactome,reactome,,,,['Diseases of Immune System'],ok,
R-HSA-5423599,R-HSA-5423599,126740,R-HSA-5423599,Diseases of Mismatch Repair (MMR),Reactome,reactome,,,,['Diseases of Mismatch Repair (MMR)'],ok,
R-HSA-9673013,R-HSA-9673013,126741,R-HSA-9673013,Diseases of Telomere Maintenance,Reactome,reactome,,,,['Diseases of Telomere Maintenance'],ok,
R-HSA-9865118,R-HSA-9865118,126742,R-HSA-9865118,Diseases of branched-chain amino acid catabolism,Reactome,reactome,,,,['Diseases of branched-chain amino acid catabolism'],ok,
R-HSA-5663084,R-HSA-5663084,126743,R-HSA-5663084,Diseases of carbohydrate metabolism,Reactome,reactome,,,,['Diseases of carbohydrate metabolism'],ok,
R-HSA-9675132,R-HSA-9675132,126744,R-HSA-9675132,Diseases of cellular response to stress,Reactome,reactome,,,,['Diseases of cellular response to stress'],ok,
R-HSA-3781865,R-HSA-3781865,126745,R-HSA-3781865,Diseases of glycosylation,Reactome,reactome,,,,['Diseases of glycosylation'],ok,
R-HSA-9671793,R-HSA-9671793,126746,R-HSA-9671793,Diseases of hemostasis,Reactome,reactome,,,,['Diseases of hemostasis'],ok,
R-HSA-5668914,R-HSA-5668914,126747,R-HSA-5668914,Diseases of metabolism,Reactome,reactome,,,,['Diseases of metabolism'],ok,
R-HSA-9759774,R-HSA-9759774,126748,R-HSA-9759774,Diseases of mitochondrial beta oxidation,Reactome,reactome,,,,['Diseases of mitochondrial beta oxidation'],ok,
R-HSA-9675126,R-HSA-9675126,126749,R-HSA-9675126,Diseases of mitotic cell cycle,Reactome,reactome,,,,['Diseases of mitotic cell cycle'],ok,
R-HSA-9735804,R-HSA-9735804,126750,R-HSA-9735804,Diseases of nucleotide metabolism,Reactome,reactome,,,,['Diseases of nucleotide metabolism'],ok,
R-HSA-9645723,R-HSA-9645723,126751,R-HSA-9645723,Diseases of programmed cell death,Reactome,reactome,,,,['Diseases of programmed cell death'],ok,
R-HSA-9759785,R-HSA-9759785,126752,R-HSA-9759785,Diseases of propionyl-CoA catabolism,Reactome,reactome,,,,['Diseases of propionyl-CoA catabolism'],ok,
R-HSA-5663202,R-HSA-5663202,126753,R-HSA-5663202,Diseases of signal transduction by growth factor receptors and second messengers,Reactome,reactome,,,,['Diseases of signal transduction by growth factor receptors and second messengers'],ok,
R-HSA-9675143,R-HSA-9675143,126754,R-HSA-9675143,Diseases of the neuronal system,Reactome,reactome,,,,['Diseases of the neuronal system'],ok,
R-HSA-9955698,R-HSA-9955698,126755,R-HSA-9955698,Diseases of the urea cycle,Reactome,reactome,,,,['Diseases of the urea cycle'],ok,
R-HSA-114516,R-HSA-114516,126756,R-HSA-114516,Disinhibition of SNARE formation,Reactome,reactome,,,,['Disinhibition of SNARE formation'],ok,
R-HSA-9675151,R-HSA-9675151,126757,R-HSA-9675151,Disorders of Developmental Biology,Reactome,reactome,,,,['Disorders of Developmental Biology'],ok,
R-HSA-9697154,R-HSA-9697154,126758,R-HSA-9697154,Disorders of Nervous System Development,Reactome,reactome,,,,['Disorders of Nervous System Development'],ok,
R-HSA-5619115,R-HSA-5619115,126759,R-HSA-5619115,Disorders of transmembrane transporters,Reactome,reactome,,,,['Disorders of transmembrane transporters'],ok,
R-HSA-110357,R-HSA-110357,126760,R-HSA-110357,Displacement of DNA glycosylase by APEX1,Reactome,reactome,,,,['Displacement of DNA glycosylase by APEX1'],ok,
R-HSA-75205,R-HSA-75205,126761,R-HSA-75205,Dissolution of Fibrin Clot,Reactome,reactome,,,,['Dissolution of Fibrin Clot'],ok,
R-HSA-212676,R-HSA-212676,126762,R-HSA-212676,Dopamine Neurotransmitter Release Cycle,Reactome,reactome,,,,['Dopamine Neurotransmitter Release Cycle'],ok,
R-HSA-379401,R-HSA-379401,126763,R-HSA-379401,Dopamine clearance from the synaptic cleft,Reactome,reactome,,,,['Dopamine clearance from the synaptic cleft'],ok,
R-HSA-390651,R-HSA-390651,126764,R-HSA-390651,Dopamine receptors,Reactome,reactome,,,,['Dopamine receptors'],ok,
R-HSA-8863795,R-HSA-8863795,126765,R-HSA-8863795,Downregulation of ERBB2 signaling,Reactome,reactome,,,,['Downregulation of ERBB2 signaling'],ok,
R-HSA-1358803,R-HSA-1358803,126766,R-HSA-1358803,Downregulation of ERBB2:ERBB3 signaling,Reactome,reactome,,,,['Downregulation of ERBB2:ERBB3 signaling'],ok,
R-HSA-1253288,R-HSA-1253288,126767,R-HSA-1253288,Downregulation of ERBB4 signaling,Reactome,reactome,,,,['Downregulation of ERBB4 signaling'],ok,
R-HSA-2173795,R-HSA-2173795,126768,R-HSA-2173795,Downregulation of SMAD2/3:SMAD4 transcriptional activity,Reactome,reactome,,,,['Downregulation of SMAD2/3:SMAD4 transcriptional activity'],ok,
R-HSA-2173788,R-HSA-2173788,126769,R-HSA-2173788,Downregulation of TGF-beta receptor signaling,Reactome,reactome,,,,['Downregulation of TGF-beta receptor signaling'],ok,
R-HSA-202424,R-HSA-202424,126770,R-HSA-202424,Downstream TCR signaling,Reactome,reactome,,,,['Downstream TCR signaling'],ok,
R-HSA-186763,R-HSA-186763,126771,R-HSA-186763,Downstream signal transduction,Reactome,reactome,,,,['Downstream signal transduction'],ok,
R-HSA-1168372,R-HSA-1168372,126772,R-HSA-1168372,Downstream signaling events of B Cell Receptor (BCR),Reactome,reactome,,,,['Downstream signaling events of B Cell Receptor (BCR)'],ok,
R-HSA-5654687,R-HSA-5654687,126773,R-HSA-5654687,Downstream signaling of activated FGFR1,Reactome,reactome,,,,['Downstream signaling of activated FGFR1'],ok,
R-HSA-5654696,R-HSA-5654696,126774,R-HSA-5654696,Downstream signaling of activated FGFR2,Reactome,reactome,,,,['Downstream signaling of activated FGFR2'],ok,
R-HSA-5654708,R-HSA-5654708,126775,R-HSA-5654708,Downstream signaling of activated FGFR3,Reactome,reactome,,,,['Downstream signaling of activated FGFR3'],ok,
R-HSA-5654716,R-HSA-5654716,126776,R-HSA-5654716,Downstream signaling of activated FGFR4,Reactome,reactome,,,,['Downstream signaling of activated FGFR4'],ok,
R-HSA-9748784,R-HSA-9748784,126777,R-HSA-9748784,Drug ADME,Reactome,reactome,,,,['Drug ADME'],ok,
R-HSA-9665230,R-HSA-9665230,126778,R-HSA-9665230,Drug resistance in ERBB2 KD mutants,Reactome,reactome,,,,['Drug resistance in ERBB2 KD mutants'],ok,
R-HSA-9665737,R-HSA-9665737,126779,R-HSA-9665737,Drug resistance in ERBB2 TMD/JMD mutants,Reactome,reactome,,,,['Drug resistance in ERBB2 TMD/JMD mutants'],ok,
R-HSA-9700649,R-HSA-9700649,126780,R-HSA-9700649,Drug resistance of ALK mutants,Reactome,reactome,,,,['Drug resistance of ALK mutants'],ok,
R-HSA-9702506,R-HSA-9702506,126781,R-HSA-9702506,Drug resistance of FLT3 mutants,Reactome,reactome,,,,['Drug resistance of FLT3 mutants'],ok,
R-HSA-9669937,R-HSA-9669937,126782,R-HSA-9669937,Drug resistance of KIT mutants,Reactome,reactome,,,,['Drug resistance of KIT mutants'],ok,
R-HSA-9674415,R-HSA-9674415,126783,R-HSA-9674415,Drug resistance of PDGFR mutants,Reactome,reactome,,,,['Drug resistance of PDGFR mutants'],ok,
R-HSA-9750126,R-HSA-9750126,126784,R-HSA-9750126,Drug-induced formation of DNA interstrand crosslinks,Reactome,reactome,,,,['Drug-induced formation of DNA interstrand crosslinks'],ok,
R-HSA-9754119,R-HSA-9754119,126785,R-HSA-9754119,Drug-mediated inhibition of CDK4/CDK6 activity,Reactome,reactome,,,,['Drug-mediated inhibition of CDK4/CDK6 activity'],ok,
R-HSA-9652282,R-HSA-9652282,126786,R-HSA-9652282,Drug-mediated inhibition of ERBB2 signaling,Reactome,reactome,,,,['Drug-mediated inhibition of ERBB2 signaling'],ok,
R-HSA-9734091,R-HSA-9734091,126787,R-HSA-9734091,Drug-mediated inhibition of MET activation,Reactome,reactome,,,,['Drug-mediated inhibition of MET activation'],ok,
R-HSA-5696400,R-HSA-5696400,126788,R-HSA-5696400,Dual Incision in GG-NER,Reactome,reactome,,,,['Dual Incision in GG-NER'],ok,
R-HSA-6782135,R-HSA-6782135,126789,R-HSA-6782135,Dual incision in TC-NER,Reactome,reactome,,,,['Dual incision in TC-NER'],ok,
R-HSA-113510,R-HSA-113510,126790,R-HSA-113510,E2F mediated regulation of DNA replication,Reactome,reactome,,,,['E2F mediated regulation of DNA replication'],ok,
R-HSA-113507,R-HSA-113507,126791,R-HSA-113507,E2F-enabled inhibition of pre-replication complex formation,Reactome,reactome,,,,['E2F-enabled inhibition of pre-replication complex formation'],ok,
R-HSA-8866654,R-HSA-8866654,126792,R-HSA-8866654,E3 ubiquitin ligases ubiquitinate target proteins,Reactome,reactome,,,,['E3 ubiquitin ligases ubiquitinate target proteins'],ok,
R-HSA-3000178,R-HSA-3000178,126793,R-HSA-3000178,ECM proteoglycans,Reactome,reactome,,,,['ECM proteoglycans'],ok,
R-HSA-2179392,R-HSA-2179392,126794,R-HSA-2179392,EGFR Transactivation by Gastrin,Reactome,reactome,,,,['EGFR Transactivation by Gastrin'],ok,
R-HSA-182971,R-HSA-182971,126795,R-HSA-182971,EGFR downregulation,Reactome,reactome,,,,['EGFR downregulation'],ok,
R-HSA-212718,R-HSA-212718,126796,R-HSA-212718,EGFR interacts with phospholipase C-gamma,Reactome,reactome,,,,['EGFR interacts with phospholipase C-gamma'],ok,
R-HSA-9619665,R-HSA-9619665,126797,R-HSA-9619665,EGR2 and SOX10-mediated initiation of Schwann cell myelination,Reactome,reactome,,,,['EGR2 and SOX10-mediated initiation of Schwann cell myelination'],ok,
R-HSA-9648025,R-HSA-9648025,126798,R-HSA-9648025,EML4 and NUDC in mitotic spindle formation,Reactome,reactome,,,,['EML4 and NUDC in mitotic spindle formation'],ok,
R-HSA-2682334,R-HSA-2682334,126799,R-HSA-2682334,EPH-Ephrin signaling,Reactome,reactome,,,,['EPH-Ephrin signaling'],ok,
R-HSA-3928665,R-HSA-3928665,126800,R-HSA-3928665,EPH-ephrin mediated repulsion of cells,Reactome,reactome,,,,['EPH-ephrin mediated repulsion of cells'],ok,
R-HSA-3928663,R-HSA-3928663,126801,R-HSA-3928663,EPHA-mediated growth cone collapse,Reactome,reactome,,,,['EPHA-mediated growth cone collapse'],ok,
R-HSA-3928662,R-HSA-3928662,126802,R-HSA-3928662,EPHB-mediated forward signaling,Reactome,reactome,,,,['EPHB-mediated forward signaling'],ok,
R-HSA-901032,R-HSA-901032,126803,R-HSA-901032,ER Quality Control Compartment (ERQC),Reactome,reactome,,,,['ER Quality Control Compartment (ERQC)'],ok,
R-HSA-199977,R-HSA-199977,126804,R-HSA-199977,ER to Golgi Anterograde Transport,Reactome,reactome,,,,['ER to Golgi Anterograde Transport'],ok,
R-HSA-1236974,R-HSA-1236974,126805,R-HSA-1236974,ER-Phagosome pathway,Reactome,reactome,,,,['ER-Phagosome pathway'],ok,
R-HSA-8847993,R-HSA-8847993,126806,R-HSA-8847993,ERBB2 Activates PTK6 Signaling,Reactome,reactome,,,,['ERBB2 Activates PTK6 Signaling'],ok,
R-HSA-6785631,R-HSA-6785631,126807,R-HSA-6785631,ERBB2 Regulates Cell Motility,Reactome,reactome,,,,['ERBB2 Regulates Cell Motility'],ok,
R-HSA-427389,R-HSA-427389,126808,R-HSA-427389,ERCC6 (CSB) and EHMT2 (G9a) positively regulate rRNA expression,Reactome,reactome,,,,['ERCC6 (CSB) and EHMT2 (G9a) positively regulate rRNA expression'],ok,
R-HSA-198753,R-HSA-198753,126809,R-HSA-198753,ERK/MAPK targets,Reactome,reactome,,,,['ERK/MAPK targets'],ok,
R-HSA-202670,R-HSA-202670,126810,R-HSA-202670,ERKs are inactivated,Reactome,reactome,,,,['ERKs are inactivated'],ok,
R-HSA-8939211,R-HSA-8939211,126811,R-HSA-8939211,ESR-mediated signaling,Reactome,reactome,,,,['ESR-mediated signaling'],ok,
R-HSA-162594,R-HSA-162594,126812,R-HSA-162594,Early Phase of HIV Life Cycle,Reactome,reactome,,,,['Early Phase of HIV Life Cycle'],ok,
R-HSA-9772572,R-HSA-9772572,126813,R-HSA-9772572,Early SARS-CoV-2 Infection Events,Reactome,reactome,,,,['Early SARS-CoV-2 Infection Events'],ok,
R-HSA-114508,R-HSA-114508,126814,R-HSA-114508,Effects of PIP2 hydrolysis,Reactome,reactome,,,,['Effects of PIP2 hydrolysis'],ok,
R-HSA-391903,R-HSA-391903,126815,R-HSA-391903,Eicosanoid ligand-binding receptors,Reactome,reactome,,,,['Eicosanoid ligand-binding receptors'],ok,
R-HSA-211979,R-HSA-211979,126816,R-HSA-211979,Eicosanoids,Reactome,reactome,,,,['Eicosanoids'],ok,
R-HSA-1566948,R-HSA-1566948,126817,R-HSA-1566948,Elastic fibre formation,Reactome,reactome,,,,['Elastic fibre formation'],ok,
R-HSA-112303,R-HSA-112303,126818,R-HSA-112303,Electric Transmission Across Gap Junctions,Reactome,reactome,,,,['Electric Transmission Across Gap Junctions'],ok,
R-HSA-2395516,R-HSA-2395516,126819,R-HSA-2395516,Electron transport from NADPH to Ferredoxin,Reactome,reactome,,,,['Electron transport from NADPH to Ferredoxin'],ok,
R-HSA-139853,R-HSA-139853,126820,R-HSA-139853,Elevation of cytosolic Ca2+ levels,Reactome,reactome,,,,['Elevation of cytosolic Ca2+ levels'],ok,
R-HSA-211976,R-HSA-211976,126821,R-HSA-211976,Endogenous sterols,Reactome,reactome,,,,['Endogenous sterols'],ok,
R-HSA-917729,R-HSA-917729,126822,R-HSA-917729,Endosomal Sorting Complex Required For Transport (ESCRT),Reactome,reactome,,,,['Endosomal Sorting Complex Required For Transport (ESCRT)'],ok,
R-HSA-1236977,R-HSA-1236977,126823,R-HSA-1236977,Endosomal/Vacuolar pathway,Reactome,reactome,,,,['Endosomal/Vacuolar pathway'],ok,
R-HSA-380972,R-HSA-380972,126824,R-HSA-380972,Energy dependent regulation of mTOR by LKB1-AMPK,Reactome,reactome,,,,['Energy dependent regulation of mTOR by LKB1-AMPK'],ok,
R-HSA-9845620,R-HSA-9845620,126825,R-HSA-9845620,Enhanced binding of GP1BA variant to VWF multimer:collagen ,Reactome,reactome,,,,['Enhanced binding of GP1BA variant to VWF multimer:collagen'],ok,
R-HSA-9845619,R-HSA-9845619,126826,R-HSA-9845619,Enhanced cleavage of VWF variant by ADAMTS13,Reactome,reactome,,,,['Enhanced cleavage of VWF variant by ADAMTS13'],ok,
R-HSA-9956593,R-HSA-9956593,126827,R-HSA-9956593,Enterobacterial factors antagonize host defense ,Reactome,reactome,,,,['Enterobacterial factors antagonize host defense'],ok,
R-HSA-168275,R-HSA-168275,126828,R-HSA-168275,Entry of Influenza Virion into Host Cell via Endocytosis,Reactome,reactome,,,,['Entry of Influenza Virion into Host Cell via Endocytosis'],ok,
R-HSA-379398,R-HSA-379398,126829,R-HSA-379398,Enzymatic degradation of Dopamine by monoamine oxidase,Reactome,reactome,,,,['Enzymatic degradation of Dopamine by monoamine oxidase'],ok,
R-HSA-379397,R-HSA-379397,126830,R-HSA-379397,Enzymatic degradation of dopamine by COMT,Reactome,reactome,,,,['Enzymatic degradation of dopamine by COMT'],ok,
R-HSA-3928664,R-HSA-3928664,126831,R-HSA-3928664,Ephrin signaling,Reactome,reactome,,,,['Ephrin signaling'],ok,
R-HSA-9917777,R-HSA-9917777,126832,R-HSA-9917777,Epigenetic regulation by WDR5-containing histone modifying complexes,Reactome,reactome,,,,['Epigenetic regulation by WDR5-containing histone modifying complexes'],ok,
R-HSA-9851695,R-HSA-9851695,126833,R-HSA-9851695,Epigenetic regulation of adipogenesis genes by MLL3 and MLL4 complexes,Reactome,reactome,,,,['Epigenetic regulation of adipogenesis genes by MLL3 and MLL4 complexes'],ok,
R-HSA-212165,R-HSA-212165,126834,R-HSA-212165,Epigenetic regulation of gene expression,Reactome,reactome,,,,['Epigenetic regulation of gene expression'],ok,
R-HSA-9818564,R-HSA-9818564,126835,R-HSA-9818564,Epigenetic regulation of gene expression by MLL3 and MLL4 complexes,Reactome,reactome,,,,['Epigenetic regulation of gene expression by MLL3 and MLL4 complexes'],ok,
R-HSA-9758919,R-HSA-9758919,126836,R-HSA-9758919,Epithelial-Mesenchymal Transition (EMT) during gastrulation,Reactome,reactome,,,,['Epithelial-Mesenchymal Transition (EMT) during gastrulation'],ok,
R-HSA-1237044,R-HSA-1237044,126837,R-HSA-1237044,Erythrocytes take up carbon dioxide and release oxygen,Reactome,reactome,,,,['Erythrocytes take up carbon dioxide and release oxygen'],ok,
R-HSA-1247673,R-HSA-1247673,126838,R-HSA-1247673,Erythrocytes take up oxygen and release carbon dioxide,Reactome,reactome,,,,['Erythrocytes take up oxygen and release carbon dioxide'],ok,
R-HSA-9027276,R-HSA-9027276,126839,R-HSA-9027276,Erythropoietin activates Phosphoinositide-3-kinase (PI3K),Reactome,reactome,,,,['Erythropoietin activates Phosphoinositide-3-kinase (PI3K)'],ok,
R-HSA-9027277,R-HSA-9027277,126840,R-HSA-9027277,Erythropoietin activates Phospholipase C gamma (PLCG),Reactome,reactome,,,,['Erythropoietin activates Phospholipase C gamma (PLCG)'],ok,
R-HSA-9027284,R-HSA-9027284,126841,R-HSA-9027284,Erythropoietin activates RAS,Reactome,reactome,,,,['Erythropoietin activates RAS'],ok,
R-HSA-9027283,R-HSA-9027283,126842,R-HSA-9027283,Erythropoietin activates STAT5,Reactome,reactome,,,,['Erythropoietin activates STAT5'],ok,
R-HSA-9637679,R-HSA-9637679,126843,R-HSA-9637679,Escape of Mtb from the phagocyte,Reactome,reactome,,,,['Escape of Mtb from the phagocyte'],ok,
R-HSA-5657562,R-HSA-5657562,126844,R-HSA-5657562,Essential fructosuria,Reactome,reactome,,,,['Essential fructosuria'],ok,
R-HSA-5662853,R-HSA-5662853,126845,R-HSA-5662853,Essential pentosuria,Reactome,reactome,,,,['Essential pentosuria'],ok,
R-HSA-2468052,R-HSA-2468052,126846,R-HSA-2468052,Establishment of Sister Chromatid Cohesion,Reactome,reactome,,,,['Establishment of Sister Chromatid Cohesion'],ok,
R-HSA-193144,R-HSA-193144,126847,R-HSA-193144,Estrogen biosynthesis,Reactome,reactome,,,,['Estrogen biosynthesis'],ok,
R-HSA-9018519,R-HSA-9018519,126848,R-HSA-9018519,Estrogen-dependent gene expression,Reactome,reactome,,,,['Estrogen-dependent gene expression'],ok,
R-HSA-9634638,R-HSA-9634638,126849,R-HSA-9634638,Estrogen-dependent nuclear events downstream of ESR-membrane signaling,Reactome,reactome,,,,['Estrogen-dependent nuclear events downstream of ESR-membrane signaling'],ok,
R-HSA-9634635,R-HSA-9634635,126850,R-HSA-9634635,Estrogen-stimulated signaling through PRKCZ,Reactome,reactome,,,,['Estrogen-stimulated signaling through PRKCZ'],ok,
R-HSA-71384,R-HSA-71384,126851,R-HSA-71384,Ethanol oxidation,Reactome,reactome,,,,['Ethanol oxidation'],ok,
R-HSA-156842,R-HSA-156842,126852,R-HSA-156842,Eukaryotic Translation Elongation,Reactome,reactome,,,,['Eukaryotic Translation Elongation'],ok,
R-HSA-72613,R-HSA-72613,126853,R-HSA-72613,Eukaryotic Translation Initiation,Reactome,reactome,,,,['Eukaryotic Translation Initiation'],ok,
R-HSA-72764,R-HSA-72764,126854,R-HSA-72764,Eukaryotic Translation Termination,Reactome,reactome,,,,['Eukaryotic Translation Termination'],ok,
R-HSA-9833109,R-HSA-9833109,126855,R-HSA-9833109,Evasion by RSV of host interferon responses,Reactome,reactome,,,,['Evasion by RSV of host interferon responses'],ok,
R-HSA-9630791,R-HSA-9630791,126856,R-HSA-9630791,Evasion of Oncogene Induced Senescence Due to Defective p16INK4A binding to CDK4,Reactome,reactome,,,,['Evasion of Oncogene Induced Senescence Due to Defective p16INK4A binding to CDK4'],ok,
R-HSA-9630794,R-HSA-9630794,126857,R-HSA-9630794,Evasion of Oncogene Induced Senescence Due to Defective p16INK4A binding to CDK4 and CDK6,Reactome,reactome,,,,['Evasion of Oncogene Induced Senescence Due to Defective p16INK4A binding to CDK4 and CDK6'],ok,
R-HSA-9646303,R-HSA-9646303,126858,R-HSA-9646303,Evasion of Oncogene Induced Senescence Due to p14ARF Defects,Reactome,reactome,,,,['Evasion of Oncogene Induced Senescence Due to p14ARF Defects'],ok,
R-HSA-9630750,R-HSA-9630750,126859,R-HSA-9630750,Evasion of Oncogene Induced Senescence Due to p16INK4A Defects,Reactome,reactome,,,,['Evasion of Oncogene Induced Senescence Due to p16INK4A Defects'],ok,
R-HSA-9632697,R-HSA-9632697,126860,R-HSA-9632697,Evasion of Oxidative Stress Induced Senescence Due to Defective p16INK4A binding to CDK4,Reactome,reactome,,,,['Evasion of Oxidative Stress Induced Senescence Due to Defective p16INK4A binding to CDK4'],ok,
R-HSA-9632700,R-HSA-9632700,126861,R-HSA-9632700,Evasion of Oxidative Stress Induced Senescence Due to Defective p16INK4A binding to CDK4 and CDK6,Reactome,reactome,,,,['Evasion of Oxidative Stress Induced Senescence Due to Defective p16INK4A binding to CDK4 and CDK6'],ok,
R-HSA-9646304,R-HSA-9646304,126862,R-HSA-9646304,Evasion of Oxidative Stress Induced Senescence Due to p14ARF Defects,Reactome,reactome,,,,['Evasion of Oxidative Stress Induced Senescence Due to p14ARF Defects'],ok,
R-HSA-9632693,R-HSA-9632693,126863,R-HSA-9632693,Evasion of Oxidative Stress Induced Senescence Due to p16INK4A Defects,Reactome,reactome,,,,['Evasion of Oxidative Stress Induced Senescence Due to p16INK4A Defects'],ok,
R-HSA-8941413,R-HSA-8941413,126864,R-HSA-8941413,Events associated with phagocytolytic activity of PMN cells,Reactome,reactome,,,,['Events associated with phagocytolytic activity of PMN cells'],ok,
R-HSA-168274,R-HSA-168274,126865,R-HSA-168274,Export of Viral Ribonucleoproteins from Nucleus,Reactome,reactome,,,,['Export of Viral Ribonucleoproteins from Nucleus'],ok,
R-HSA-9036866,R-HSA-9036866,126866,R-HSA-9036866,Expression and Processing of Neurotrophins,Reactome,reactome,,,,['Expression and Processing of Neurotrophins'],ok,
R-HSA-9752946,R-HSA-9752946,126867,R-HSA-9752946,Expression and translocation of olfactory receptors,Reactome,reactome,,,,['Expression and translocation of olfactory receptors'],ok,
R-HSA-9931509,R-HSA-9931509,126868,R-HSA-9931509,"Expression of BMAL (ARNTL), CLOCK, and NPAS2",Reactome,reactome,,,,"['Expression of BMAL (ARNTL), CLOCK, and NPAS2']",ok,
R-HSA-9911233,R-HSA-9911233,126869,R-HSA-9911233,Expression of NOTCH2NL genes,Reactome,reactome,,,,['Expression of NOTCH2NL genes'],ok,
R-HSA-180786,R-HSA-180786,126870,R-HSA-180786,Extension of Telomeres,Reactome,reactome,,,,['Extension of Telomeres'],ok,
R-HSA-9009391,R-HSA-9009391,126871,R-HSA-9009391,Extra-nuclear estrogen signaling,Reactome,reactome,,,,['Extra-nuclear estrogen signaling'],ok,
R-HSA-1474244,R-HSA-1474244,126872,R-HSA-1474244,Extracellular matrix organization,Reactome,reactome,,,,['Extracellular matrix organization'],ok,
R-HSA-140834,R-HSA-140834,126873,R-HSA-140834,Extrinsic Pathway of Fibrin Clot Formation,Reactome,reactome,,,,['Extrinsic Pathway of Fibrin Clot Formation'],ok,
R-HSA-9837092,R-HSA-9837092,126874,R-HSA-9837092,FASTK family proteins regulate processing and stability of mitochondrial RNAs,Reactome,reactome,,,,['FASTK family proteins regulate processing and stability of mitochondrial RNAs'],ok,
R-HSA-8854050,R-HSA-8854050,126875,R-HSA-8854050,FBXL7 down-regulates AURKA during mitotic entry and in early mitosis,Reactome,reactome,,,,['FBXL7 down-regulates AURKA during mitotic entry and in early mitosis'],ok,
R-HSA-2644605,R-HSA-2644605,126876,R-HSA-2644605,FBXW7 Mutants and NOTCH1 in Cancer,Reactome,reactome,,,,['FBXW7 Mutants and NOTCH1 in Cancer'],ok,
R-HSA-2871809,R-HSA-2871809,126877,R-HSA-2871809,FCERI mediated Ca+2 mobilization,Reactome,reactome,,,,['FCERI mediated Ca+2 mobilization'],ok,
R-HSA-2871796,R-HSA-2871796,126878,R-HSA-2871796,FCERI mediated MAPK activation,Reactome,reactome,,,,['FCERI mediated MAPK activation'],ok,
R-HSA-2871837,R-HSA-2871837,126879,R-HSA-2871837,FCERI mediated NF-kB activation,Reactome,reactome,,,,['FCERI mediated NF-kB activation'],ok,
R-HSA-2029481,R-HSA-2029481,126880,R-HSA-2029481,FCGR activation,Reactome,reactome,,,,['FCGR activation'],ok,
R-HSA-9664323,R-HSA-9664323,126881,R-HSA-9664323,FCGR3A-mediated IL10 synthesis,Reactome,reactome,,,,['FCGR3A-mediated IL10 synthesis'],ok,
R-HSA-9664422,R-HSA-9664422,126882,R-HSA-9664422,FCGR3A-mediated phagocytosis,Reactome,reactome,,,,['FCGR3A-mediated phagocytosis'],ok,
R-HSA-190242,R-HSA-190242,126883,R-HSA-190242,FGFR1 ligand binding and activation,Reactome,reactome,,,,['FGFR1 ligand binding and activation'],ok,
R-HSA-1839124,R-HSA-1839124,126884,R-HSA-1839124,FGFR1 mutant receptor activation,Reactome,reactome,,,,['FGFR1 mutant receptor activation'],ok,
R-HSA-190370,R-HSA-190370,126885,R-HSA-190370,FGFR1b ligand binding and activation,Reactome,reactome,,,,['FGFR1b ligand binding and activation'],ok,
R-HSA-190374,R-HSA-190374,126886,R-HSA-190374,FGFR1c and Klotho ligand binding and activation,Reactome,reactome,,,,['FGFR1c and Klotho ligand binding and activation'],ok,
R-HSA-190373,R-HSA-190373,126887,R-HSA-190373,FGFR1c ligand binding and activation,Reactome,reactome,,,,['FGFR1c ligand binding and activation'],ok,
R-HSA-6803529,R-HSA-6803529,126888,R-HSA-6803529,FGFR2 alternative splicing,Reactome,reactome,,,,['FGFR2 alternative splicing'],ok,
R-HSA-190241,R-HSA-190241,126889,R-HSA-190241,FGFR2 ligand binding and activation,Reactome,reactome,,,,['FGFR2 ligand binding and activation'],ok,
R-HSA-1839126,R-HSA-1839126,126890,R-HSA-1839126,FGFR2 mutant receptor activation,Reactome,reactome,,,,['FGFR2 mutant receptor activation'],ok,
R-HSA-190377,R-HSA-190377,126891,R-HSA-190377,FGFR2b ligand binding and activation,Reactome,reactome,,,,['FGFR2b ligand binding and activation'],ok,
R-HSA-190375,R-HSA-190375,126892,R-HSA-190375,FGFR2c ligand binding and activation,Reactome,reactome,,,,['FGFR2c ligand binding and activation'],ok,
R-HSA-190239,R-HSA-190239,126893,R-HSA-190239,FGFR3 ligand binding and activation,Reactome,reactome,,,,['FGFR3 ligand binding and activation'],ok,
R-HSA-2033514,R-HSA-2033514,126894,R-HSA-2033514,FGFR3 mutant receptor activation,Reactome,reactome,,,,['FGFR3 mutant receptor activation'],ok,
R-HSA-190371,R-HSA-190371,126895,R-HSA-190371,FGFR3b ligand binding and activation,Reactome,reactome,,,,['FGFR3b ligand binding and activation'],ok,
R-HSA-190372,R-HSA-190372,126896,R-HSA-190372,FGFR3c ligand binding and activation,Reactome,reactome,,,,['FGFR3c ligand binding and activation'],ok,
R-HSA-190322,R-HSA-190322,126897,R-HSA-190322,FGFR4 ligand binding and activation,Reactome,reactome,,,,['FGFR4 ligand binding and activation'],ok,
R-HSA-1839128,R-HSA-1839128,126898,R-HSA-1839128,FGFR4 mutant receptor activation,Reactome,reactome,,,,['FGFR4 mutant receptor activation'],ok,
R-HSA-5658623,R-HSA-5658623,126899,R-HSA-5658623,FGFRL1 modulation of FGFR1 signaling,Reactome,reactome,,,,['FGFRL1 modulation of FGFR1 signaling'],ok,
R-HSA-9607240,R-HSA-9607240,126900,R-HSA-9607240,FLT3 Signaling,Reactome,reactome,,,,['FLT3 Signaling'],ok,
R-HSA-9702509,R-HSA-9702509,126901,R-HSA-9702509,FLT3 mutants bind TKIs,Reactome,reactome,,,,['FLT3 mutants bind TKIs'],ok,
R-HSA-9706377,R-HSA-9706377,126902,R-HSA-9706377,FLT3 signaling by CBL mutants,Reactome,reactome,,,,['FLT3 signaling by CBL mutants'],ok,
