input_value,input_matched_alias,entity_id,pathway_id,pathway_description,pathway_source_system,pathway_data_source,pathway_etl_package_id,entity_relationships_by_group,total_entity_relationships,other_aliases,status,note
R-HSA-2467813,R-HSA-2467813,128243,R-HSA-2467813,Separation of Sister Chromatids,Reactome,reactome,,,,['Separation of Sister Chromatids'],ok,
R-HSA-977347,R-HSA-977347,128244,R-HSA-977347,Serine metabolism,Reactome,reactome,,,,['Serine metabolism'],ok,
R-HSA-181429,R-HSA-181429,128245,R-HSA-181429,Serotonin Neurotransmitter Release Cycle,Reactome,reactome,,,,['Serotonin Neurotransmitter Release Cycle'],ok,
R-HSA-209931,R-HSA-209931,128246,R-HSA-209931,Serotonin and melatonin biosynthesis,Reactome,reactome,,,,['Serotonin and melatonin biosynthesis'],ok,
R-HSA-380615,R-HSA-380615,128247,R-HSA-380615,Serotonin clearance from the synaptic cleft,Reactome,reactome,,,,['Serotonin clearance from the synaptic cleft'],ok,
R-HSA-390666,R-HSA-390666,128248,R-HSA-390666,Serotonin receptors,Reactome,reactome,,,,['Serotonin receptors'],ok,
R-HSA-3282872,R-HSA-3282872,128249,R-HSA-3282872,Severe congenital neutropenia type 4 (G6PC3),Reactome,reactome,,,,['Severe congenital neutropenia type 4 (G6PC3)'],ok,
R-HSA-4085001,R-HSA-4085001,128250,R-HSA-4085001,Sialic acid metabolism,Reactome,reactome,,,,['Sialic acid metabolism'],ok,
R-HSA-162582,R-HSA-162582,128251,R-HSA-162582,Signal Transduction,Reactome,reactome,,,,['Signal Transduction'],ok,
R-HSA-392518,R-HSA-392518,128252,R-HSA-392518,Signal amplification,Reactome,reactome,,,,['Signal amplification'],ok,
R-HSA-74749,R-HSA-74749,128253,R-HSA-74749,Signal attenuation,Reactome,reactome,,,,['Signal attenuation'],ok,
R-HSA-391160,R-HSA-391160,128254,R-HSA-391160,Signal regulatory protein family interactions,Reactome,reactome,,,,['Signal regulatory protein family interactions'],ok,
R-HSA-445144,R-HSA-445144,128255,R-HSA-445144,Signal transduction by L1,Reactome,reactome,,,,['Signal transduction by L1'],ok,
R-HSA-201556,R-HSA-201556,128256,R-HSA-201556,Signaling by ALK,Reactome,reactome,,,,['Signaling by ALK'],ok,
R-HSA-9725370,R-HSA-9725370,128257,R-HSA-9725370,Signaling by ALK fusions and activated point mutants,Reactome,reactome,,,,['Signaling by ALK fusions and activated point mutants'],ok,
R-HSA-9700206,R-HSA-9700206,128258,R-HSA-9700206,Signaling by ALK in cancer,Reactome,reactome,,,,['Signaling by ALK in cancer'],ok,
R-HSA-4839748,R-HSA-4839748,128259,R-HSA-4839748,Signaling by AMER1 mutants,Reactome,reactome,,,,['Signaling by AMER1 mutants'],ok,
R-HSA-4839744,R-HSA-4839744,128260,R-HSA-4839744,Signaling by APC mutants,Reactome,reactome,,,,['Signaling by APC mutants'],ok,
R-HSA-4839735,R-HSA-4839735,128261,R-HSA-4839735,Signaling by AXIN mutants,Reactome,reactome,,,,['Signaling by AXIN mutants'],ok,
R-HSA-1502540,R-HSA-1502540,128262,R-HSA-1502540,Signaling by Activin,Reactome,reactome,,,,['Signaling by Activin'],ok,
R-HSA-201451,R-HSA-201451,128263,R-HSA-201451,Signaling by BMP,Reactome,reactome,,,,['Signaling by BMP'],ok,
R-HSA-6802952,R-HSA-6802952,128264,R-HSA-6802952,Signaling by BRAF and RAF1 fusions,Reactome,reactome,,,,['Signaling by BRAF and RAF1 fusions'],ok,
R-HSA-9680350,R-HSA-9680350,128265,R-HSA-9680350,Signaling by CSF1 (M-CSF) in myeloid cells,Reactome,reactome,,,,['Signaling by CSF1 (M-CSF) in myeloid cells'],ok,
R-HSA-9674555,R-HSA-9674555,128266,R-HSA-9674555,Signaling by CSF3 (G-CSF),Reactome,reactome,,,,['Signaling by CSF3 (G-CSF)'],ok,
R-HSA-4839743,R-HSA-4839743,128267,R-HSA-4839743,Signaling by CTNNB1 phospho-site mutants,Reactome,reactome,,,,['Signaling by CTNNB1 phospho-site mutants'],ok,
R-HSA-177929,R-HSA-177929,128268,R-HSA-177929,Signaling by EGFR,Reactome,reactome,,,,['Signaling by EGFR'],ok,
R-HSA-1643713,R-HSA-1643713,128269,R-HSA-1643713,Signaling by EGFR in Cancer,Reactome,reactome,,,,['Signaling by EGFR in Cancer'],ok,
R-HSA-5637812,R-HSA-5637812,128270,R-HSA-5637812,Signaling by EGFRvIII in Cancer,Reactome,reactome,,,,['Signaling by EGFRvIII in Cancer'],ok,
R-HSA-1227986,R-HSA-1227986,128271,R-HSA-1227986,Signaling by ERBB2,Reactome,reactome,,,,['Signaling by ERBB2'],ok,
R-HSA-9665348,R-HSA-9665348,128272,R-HSA-9665348,Signaling by ERBB2 ECD mutants,Reactome,reactome,,,,['Signaling by ERBB2 ECD mutants'],ok,
R-HSA-9664565,R-HSA-9664565,128273,R-HSA-9664565,Signaling by ERBB2 KD Mutants,Reactome,reactome,,,,['Signaling by ERBB2 KD Mutants'],ok,
R-HSA-9665686,R-HSA-9665686,128274,R-HSA-9665686,Signaling by ERBB2 TMD/JMD mutants,Reactome,reactome,,,,['Signaling by ERBB2 TMD/JMD mutants'],ok,
R-HSA-1227990,R-HSA-1227990,128275,R-HSA-1227990,Signaling by ERBB2 in Cancer,Reactome,reactome,,,,['Signaling by ERBB2 in Cancer'],ok,
R-HSA-1236394,R-HSA-1236394,128276,R-HSA-1236394,Signaling by ERBB4,Reactome,reactome,,,,['Signaling by ERBB4'],ok,
R-HSA-9006335,R-HSA-9006335,128277,R-HSA-9006335,Signaling by Erythropoietin,Reactome,reactome,,,,['Signaling by Erythropoietin'],ok,
R-HSA-190236,R-HSA-190236,128278,R-HSA-190236,Signaling by FGFR,Reactome,reactome,,,,['Signaling by FGFR'],ok,
R-HSA-1226099,R-HSA-1226099,128279,R-HSA-1226099,Signaling by FGFR in disease,Reactome,reactome,,,,['Signaling by FGFR in disease'],ok,
R-HSA-5654736,R-HSA-5654736,128280,R-HSA-5654736,Signaling by FGFR1,Reactome,reactome,,,,['Signaling by FGFR1'],ok,
R-HSA-1839120,R-HSA-1839120,128281,R-HSA-1839120,Signaling by FGFR1 amplification mutants,Reactome,reactome,,,,['Signaling by FGFR1 amplification mutants'],ok,
R-HSA-5655302,R-HSA-5655302,128282,R-HSA-5655302,Signaling by FGFR1 in disease,Reactome,reactome,,,,['Signaling by FGFR1 in disease'],ok,
R-HSA-5654738,R-HSA-5654738,128283,R-HSA-5654738,Signaling by FGFR2,Reactome,reactome,,,,['Signaling by FGFR2'],ok,
R-HSA-8851708,R-HSA-8851708,128284,R-HSA-8851708,Signaling by FGFR2 IIIa TM,Reactome,reactome,,,,['Signaling by FGFR2 IIIa TM'],ok,
R-HSA-2023837,R-HSA-2023837,128285,R-HSA-2023837,Signaling by FGFR2 amplification mutants,Reactome,reactome,,,,['Signaling by FGFR2 amplification mutants'],ok,
R-HSA-8853333,R-HSA-8853333,128286,R-HSA-8853333,Signaling by FGFR2 fusions,Reactome,reactome,,,,['Signaling by FGFR2 fusions'],ok,
R-HSA-5655253,R-HSA-5655253,128287,R-HSA-5655253,Signaling by FGFR2 in disease,Reactome,reactome,,,,['Signaling by FGFR2 in disease'],ok,
R-HSA-5654741,R-HSA-5654741,128288,R-HSA-5654741,Signaling by FGFR3,Reactome,reactome,,,,['Signaling by FGFR3'],ok,
R-HSA-8853334,R-HSA-8853334,128289,R-HSA-8853334,Signaling by FGFR3 fusions in cancer,Reactome,reactome,,,,['Signaling by FGFR3 fusions in cancer'],ok,
R-HSA-5655332,R-HSA-5655332,128290,R-HSA-5655332,Signaling by FGFR3 in disease,Reactome,reactome,,,,['Signaling by FGFR3 in disease'],ok,
R-HSA-5654743,R-HSA-5654743,128291,R-HSA-5654743,Signaling by FGFR4,Reactome,reactome,,,,['Signaling by FGFR4'],ok,
R-HSA-5655291,R-HSA-5655291,128292,R-HSA-5655291,Signaling by FGFR4 in disease,Reactome,reactome,,,,['Signaling by FGFR4 in disease'],ok,
R-HSA-9703648,R-HSA-9703648,128293,R-HSA-9703648,Signaling by FLT3 ITD and TKD mutants,Reactome,reactome,,,,['Signaling by FLT3 ITD and TKD mutants'],ok,
R-HSA-9703465,R-HSA-9703465,128294,R-HSA-9703465,Signaling by FLT3 fusion proteins,Reactome,reactome,,,,['Signaling by FLT3 fusion proteins'],ok,
R-HSA-372790,R-HSA-372790,128295,R-HSA-372790,Signaling by GPCR,Reactome,reactome,,,,['Signaling by GPCR'],ok,
R-HSA-5339716,R-HSA-5339716,128296,R-HSA-5339716,Signaling by GSK3beta mutants,Reactome,reactome,,,,['Signaling by GSK3beta mutants'],ok,
R-HSA-5358351,R-HSA-5358351,128297,R-HSA-5358351,Signaling by Hedgehog,Reactome,reactome,,,,['Signaling by Hedgehog'],ok,
R-HSA-2028269,R-HSA-2028269,128298,R-HSA-2028269,Signaling by Hippo,Reactome,reactome,,,,['Signaling by Hippo'],ok,
R-HSA-74752,R-HSA-74752,128299,R-HSA-74752,Signaling by Insulin receptor,Reactome,reactome,,,,['Signaling by Insulin receptor'],ok,
R-HSA-449147,R-HSA-449147,128300,R-HSA-449147,Signaling by Interleukins,Reactome,reactome,,,,['Signaling by Interleukins'],ok,
R-HSA-9669938,R-HSA-9669938,128301,R-HSA-9669938,Signaling by KIT in disease,Reactome,reactome,,,,['Signaling by KIT in disease'],ok,
R-HSA-5339717,R-HSA-5339717,128302,R-HSA-5339717,Signaling by LRP5 mutants ,Reactome,reactome,,,,['Signaling by LRP5 mutants'],ok,
R-HSA-9842663,R-HSA-9842663,128303,R-HSA-9842663,Signaling by LTK,Reactome,reactome,,,,['Signaling by LTK'],ok,
R-HSA-9842640,R-HSA-9842640,128304,R-HSA-9842640,Signaling by LTK in cancer,Reactome,reactome,,,,['Signaling by LTK in cancer'],ok,
R-HSA-2586552,R-HSA-2586552,128305,R-HSA-2586552,Signaling by Leptin,Reactome,reactome,,,,['Signaling by Leptin'],ok,
R-HSA-5637815,R-HSA-5637815,128306,R-HSA-5637815,Signaling by Ligand-Responsive EGFR Variants in Cancer,Reactome,reactome,,,,['Signaling by Ligand-Responsive EGFR Variants in Cancer'],ok,
R-HSA-9652169,R-HSA-9652169,128307,R-HSA-9652169,Signaling by MAP2K mutants,Reactome,reactome,,,,['Signaling by MAP2K mutants'],ok,
R-HSA-9652817,R-HSA-9652817,128308,R-HSA-9652817,Signaling by MAPK mutants,Reactome,reactome,,,,['Signaling by MAPK mutants'],ok,
R-HSA-6806834,R-HSA-6806834,128309,R-HSA-6806834,Signaling by MET,Reactome,reactome,,,,['Signaling by MET'],ok,
R-HSA-9660537,R-HSA-9660537,128310,R-HSA-9660537,Signaling by MRAS-complex mutants,Reactome,reactome,,,,['Signaling by MRAS-complex mutants'],ok,
R-HSA-8852405,R-HSA-8852405,128311,R-HSA-8852405,Signaling by MST1,Reactome,reactome,,,,['Signaling by MST1'],ok,
R-HSA-1181150,R-HSA-1181150,128312,R-HSA-1181150,Signaling by NODAL,Reactome,reactome,,,,['Signaling by NODAL'],ok,
R-HSA-157118,R-HSA-157118,128313,R-HSA-157118,Signaling by NOTCH,Reactome,reactome,,,,['Signaling by NOTCH'],ok,
R-HSA-1980143,R-HSA-1980143,128314,R-HSA-1980143,Signaling by NOTCH1,Reactome,reactome,,,,['Signaling by NOTCH1'],ok,
R-HSA-2691230,R-HSA-2691230,128315,R-HSA-2691230,Signaling by NOTCH1 HD Domain Mutants in Cancer,Reactome,reactome,,,,['Signaling by NOTCH1 HD Domain Mutants in Cancer'],ok,
R-HSA-2894858,R-HSA-2894858,128316,R-HSA-2894858,Signaling by NOTCH1 HD+PEST Domain Mutants in Cancer,Reactome,reactome,,,,['Signaling by NOTCH1 HD+PEST Domain Mutants in Cancer'],ok,
R-HSA-2644602,R-HSA-2644602,128317,R-HSA-2644602,Signaling by NOTCH1 PEST Domain Mutants in Cancer,Reactome,reactome,,,,['Signaling by NOTCH1 PEST Domain Mutants in Cancer'],ok,
R-HSA-2644603,R-HSA-2644603,128318,R-HSA-2644603,Signaling by NOTCH1 in Cancer,Reactome,reactome,,,,['Signaling by NOTCH1 in Cancer'],ok,
R-HSA-2660825,R-HSA-2660825,128319,R-HSA-2660825,Signaling by NOTCH1 t(7;9)(NOTCH1:M1580_K2555) Translocation Mutant,Reactome,reactome,,,,['Signaling by NOTCH1 t(7;9)(NOTCH1:M1580_K2555) Translocation Mutant'],ok,
R-HSA-1980145,R-HSA-1980145,128320,R-HSA-1980145,Signaling by NOTCH2,Reactome,reactome,,,,['Signaling by NOTCH2'],ok,
R-HSA-9012852,R-HSA-9012852,128321,R-HSA-9012852,Signaling by NOTCH3,Reactome,reactome,,,,['Signaling by NOTCH3'],ok,
R-HSA-9013694,R-HSA-9013694,128322,R-HSA-9013694,Signaling by NOTCH4,Reactome,reactome,,,,['Signaling by NOTCH4'],ok,
R-HSA-187037,R-HSA-187037,128323,R-HSA-187037,Signaling by NTRK1 (TRKA),Reactome,reactome,,,,['Signaling by NTRK1 (TRKA)'],ok,
R-HSA-9006115,R-HSA-9006115,128324,R-HSA-9006115,Signaling by NTRK2 (TRKB),Reactome,reactome,,,,['Signaling by NTRK2 (TRKB)'],ok,
R-HSA-9034015,R-HSA-9034015,128325,R-HSA-9034015,Signaling by NTRK3 (TRKC),Reactome,reactome,,,,['Signaling by NTRK3 (TRKC)'],ok,
R-HSA-166520,R-HSA-166520,128326,R-HSA-166520,Signaling by NTRKs,Reactome,reactome,,,,['Signaling by NTRKs'],ok,
R-HSA-9006927,R-HSA-9006927,128327,R-HSA-9006927,Signaling by Non-Receptor Tyrosine Kinases,Reactome,reactome,,,,['Signaling by Non-Receptor Tyrosine Kinases'],ok,
R-HSA-9006931,R-HSA-9006931,128328,R-HSA-9006931,Signaling by Nuclear Receptors,Reactome,reactome,,,,['Signaling by Nuclear Receptors'],ok,
R-HSA-5638302,R-HSA-5638302,128329,R-HSA-5638302,Signaling by Overexpressed Wild-Type EGFR in Cancer,Reactome,reactome,,,,['Signaling by Overexpressed Wild-Type EGFR in Cancer'],ok,
R-HSA-186797,R-HSA-186797,128330,R-HSA-186797,Signaling by PDGF,Reactome,reactome,,,,['Signaling by PDGF'],ok,
R-HSA-9671555,R-HSA-9671555,128331,R-HSA-9671555,Signaling by PDGFR in disease,Reactome,reactome,,,,['Signaling by PDGFR in disease'],ok,
R-HSA-9673770,R-HSA-9673770,128332,R-HSA-9673770,Signaling by PDGFRA extracellular domain mutants,Reactome,reactome,,,,['Signaling by PDGFRA extracellular domain mutants'],ok,
R-HSA-9673767,R-HSA-9673767,128333,R-HSA-9673767,"Signaling by PDGFRA transmembrane, juxtamembrane and kinase domain mutants",Reactome,reactome,,,,"['Signaling by PDGFRA transmembrane, juxtamembrane and kinase domain mutants']",ok,
R-HSA-8848021,R-HSA-8848021,128334,R-HSA-8848021,Signaling by PTK6,Reactome,reactome,,,,['Signaling by PTK6'],ok,
R-HSA-9656223,R-HSA-9656223,128335,R-HSA-9656223,Signaling by RAF1 mutants,Reactome,reactome,,,,['Signaling by RAF1 mutants'],ok,
R-HSA-9753510,R-HSA-9753510,128336,R-HSA-9753510,Signaling by RAS GAP mutants,Reactome,reactome,,,,['Signaling by RAS GAP mutants'],ok,
R-HSA-9753512,R-HSA-9753512,128337,R-HSA-9753512,Signaling by RAS GTPase mutants,Reactome,reactome,,,,['Signaling by RAS GTPase mutants'],ok,
R-HSA-6802949,R-HSA-6802949,128338,R-HSA-6802949,Signaling by RAS mutants,Reactome,reactome,,,,['Signaling by RAS mutants'],ok,
R-HSA-5340588,R-HSA-5340588,128339,R-HSA-5340588,Signaling by RNF43 mutants,Reactome,reactome,,,,['Signaling by RNF43 mutants'],ok,
R-HSA-376176,R-HSA-376176,128340,R-HSA-376176,Signaling by ROBO receptors,Reactome,reactome,,,,['Signaling by ROBO receptors'],ok,
R-HSA-9006934,R-HSA-9006934,128341,R-HSA-9006934,Signaling by Receptor Tyrosine Kinases,Reactome,reactome,,,,['Signaling by Receptor Tyrosine Kinases'],ok,
R-HSA-5362517,R-HSA-5362517,128342,R-HSA-5362517,Signaling by Retinoic Acid,Reactome,reactome,,,,['Signaling by Retinoic Acid'],ok,
R-HSA-194315,R-HSA-194315,128343,R-HSA-194315,Signaling by Rho GTPases,Reactome,reactome,,,,['Signaling by Rho GTPases'],ok,
R-HSA-9716542,R-HSA-9716542,128344,R-HSA-9716542,"Signaling by Rho GTPases, Miro GTPases and RHOBTB3",Reactome,reactome,,,,"['Signaling by Rho GTPases, Miro GTPases and RHOBTB3']",ok,
R-HSA-1433557,R-HSA-1433557,128345,R-HSA-1433557,Signaling by SCF-KIT,Reactome,reactome,,,,['Signaling by SCF-KIT'],ok,
R-HSA-5339700,R-HSA-5339700,128346,R-HSA-5339700,Signaling by TCF7L2 mutants,Reactome,reactome,,,,['Signaling by TCF7L2 mutants'],ok,
R-HSA-170834,R-HSA-170834,128347,R-HSA-170834,Signaling by TGF-beta Receptor Complex,Reactome,reactome,,,,['Signaling by TGF-beta Receptor Complex'],ok,
R-HSA-3304351,R-HSA-3304351,128348,R-HSA-3304351,Signaling by TGF-beta Receptor Complex in Cancer,Reactome,reactome,,,,['Signaling by TGF-beta Receptor Complex in Cancer'],ok,
R-HSA-9006936,R-HSA-9006936,128349,R-HSA-9006936,Signaling by TGFB family members,Reactome,reactome,,,,['Signaling by TGFB family members'],ok,
R-HSA-9839373,R-HSA-9839373,128350,R-HSA-9839373,Signaling by TGFBR3,Reactome,reactome,,,,['Signaling by TGFBR3'],ok,
R-HSA-2404192,R-HSA-2404192,128351,R-HSA-2404192,Signaling by Type 1 Insulin-like Growth Factor 1 Receptor (IGF1R),Reactome,reactome,,,,['Signaling by Type 1 Insulin-like Growth Factor 1 Receptor (IGF1R)'],ok,
R-HSA-194138,R-HSA-194138,128352,R-HSA-194138,Signaling by VEGF,Reactome,reactome,,,,['Signaling by VEGF'],ok,
R-HSA-195721,R-HSA-195721,128353,R-HSA-195721,Signaling by WNT,Reactome,reactome,,,,['Signaling by WNT'],ok,
R-HSA-4791275,R-HSA-4791275,128354,R-HSA-4791275,Signaling by WNT in cancer,Reactome,reactome,,,,['Signaling by WNT in cancer'],ok,
R-HSA-1839122,R-HSA-1839122,128355,R-HSA-1839122,Signaling by activated point mutants of FGFR1,Reactome,reactome,,,,['Signaling by activated point mutants of FGFR1'],ok,
R-HSA-1839130,R-HSA-1839130,128356,R-HSA-1839130,Signaling by activated point mutants of FGFR3,Reactome,reactome,,,,['Signaling by activated point mutants of FGFR3'],ok,
R-HSA-1839117,R-HSA-1839117,128357,R-HSA-1839117,Signaling by cytosolic FGFR1 fusion mutants,Reactome,reactome,,,,['Signaling by cytosolic FGFR1 fusion mutants'],ok,
R-HSA-9673766,R-HSA-9673766,128358,R-HSA-9673766,Signaling by cytosolic PDGFRA and PDGFRB fusion proteins,Reactome,reactome,,,,['Signaling by cytosolic PDGFRA and PDGFRB fusion proteins'],ok,
R-HSA-9680187,R-HSA-9680187,128359,R-HSA-9680187,Signaling by extracellular domain mutants of KIT,Reactome,reactome,,,,['Signaling by extracellular domain mutants of KIT'],ok,
R-HSA-6802948,R-HSA-6802948,128360,R-HSA-6802948,Signaling by high-kinase activity BRAF mutants,Reactome,reactome,,,,['Signaling by high-kinase activity BRAF mutants'],ok,
R-HSA-9669935,R-HSA-9669935,128361,R-HSA-9669935,Signaling by juxtamembrane domain KIT mutants,Reactome,reactome,,,,['Signaling by juxtamembrane domain KIT mutants'],ok,
R-HSA-9669933,R-HSA-9669933,128362,R-HSA-9669933,Signaling by kinase domain mutants of KIT,Reactome,reactome,,,,['Signaling by kinase domain mutants of KIT'],ok,
R-HSA-9673768,R-HSA-9673768,128363,R-HSA-9673768,Signaling by membrane-tethered fusions of PDGFRA or PDGFRB,Reactome,reactome,,,,['Signaling by membrane-tethered fusions of PDGFRA or PDGFRB'],ok,
R-HSA-6802946,R-HSA-6802946,128364,R-HSA-6802946,Signaling by moderate kinase activity BRAF mutants,Reactome,reactome,,,,['Signaling by moderate kinase activity BRAF mutants'],ok,
R-HSA-9670439,R-HSA-9670439,128365,R-HSA-9670439,"Signaling by phosphorylated juxtamembrane, extracellular and kinase domain KIT mutants",Reactome,reactome,,,,"['Signaling by phosphorylated juxtamembrane, extracellular and kinase domain KIT mutants']",ok,
R-HSA-8853336,R-HSA-8853336,128366,R-HSA-8853336,Signaling by plasma membrane FGFR1 fusions,Reactome,reactome,,,,['Signaling by plasma membrane FGFR1 fusions'],ok,
R-HSA-983705,R-HSA-983705,128367,R-HSA-983705,Signaling by the B Cell Receptor (BCR),Reactome,reactome,,,,['Signaling by the B Cell Receptor (BCR)'],ok,
R-HSA-9649948,R-HSA-9649948,128368,R-HSA-9649948,Signaling downstream of RAS mutants,Reactome,reactome,,,,['Signaling downstream of RAS mutants'],ok,
R-HSA-198765,R-HSA-198765,128369,R-HSA-198765,Signalling to ERK5,Reactome,reactome,,,,['Signalling to ERK5'],ok,
R-HSA-187687,R-HSA-187687,128370,R-HSA-187687,Signalling to ERKs,Reactome,reactome,,,,['Signalling to ERKs'],ok,
R-HSA-167044,R-HSA-167044,128371,R-HSA-167044,Signalling to RAS,Reactome,reactome,,,,['Signalling to RAS'],ok,
R-HSA-198745,R-HSA-198745,128372,R-HSA-198745,Signalling to STAT3,Reactome,reactome,,,,['Signalling to STAT3'],ok,
R-HSA-187706,R-HSA-187706,128373,R-HSA-187706,Signalling to p38 via RIT and RIN,Reactome,reactome,,,,['Signalling to p38 via RIT and RIN'],ok,
R-HSA-426486,R-HSA-426486,128374,R-HSA-426486,Small interfering RNA (siRNA) biogenesis,Reactome,reactome,,,,['Small interfering RNA (siRNA) biogenesis'],ok,
R-HSA-445355,R-HSA-445355,128375,R-HSA-445355,Smooth Muscle Contraction,Reactome,reactome,,,,['Smooth Muscle Contraction'],ok,
R-HSA-427652,R-HSA-427652,128376,R-HSA-427652,Sodium-coupled phosphate cotransporters,Reactome,reactome,,,,['Sodium-coupled phosphate cotransporters'],ok,
R-HSA-433137,R-HSA-433137,128377,R-HSA-433137,"Sodium-coupled sulphate, di- and tri-carboxylate transporters",Reactome,reactome,,,,"['Sodium-coupled sulphate, di- and tri-carboxylate transporters']",ok,
R-HSA-425561,R-HSA-425561,128378,R-HSA-425561,Sodium/Calcium exchangers,Reactome,reactome,,,,['Sodium/Calcium exchangers'],ok,
R-HSA-425986,R-HSA-425986,128379,R-HSA-425986,Sodium/Proton exchangers,Reactome,reactome,,,,['Sodium/Proton exchangers'],ok,
R-HSA-9824272,R-HSA-9824272,128380,R-HSA-9824272,Somitogenesis,Reactome,reactome,,,,['Somitogenesis'],ok,
R-HSA-9669936,R-HSA-9669936,128381,R-HSA-9669936,Sorafenib-resistant KIT mutants,Reactome,reactome,,,,['Sorafenib-resistant KIT mutants'],ok,
R-HSA-9674404,R-HSA-9674404,128382,R-HSA-9674404,Sorafenib-resistant PDGFR mutants,Reactome,reactome,,,,['Sorafenib-resistant PDGFR mutants'],ok,
R-HSA-9827857,R-HSA-9827857,128383,R-HSA-9827857,Specification of primordial germ cells,Reactome,reactome,,,,['Specification of primordial germ cells'],ok,
R-HSA-9834899,R-HSA-9834899,128384,R-HSA-9834899,Specification of the neural plate border,Reactome,reactome,,,,['Specification of the neural plate border'],ok,
R-HSA-1300642,R-HSA-1300642,128385,R-HSA-1300642,Sperm Motility And Taxes,Reactome,reactome,,,,['Sperm Motility And Taxes'],ok,
R-HSA-9845614,R-HSA-9845614,128386,R-HSA-9845614,Sphingolipid catabolism,Reactome,reactome,,,,['Sphingolipid catabolism'],ok,
R-HSA-1660661,R-HSA-1660661,128387,R-HSA-1660661,Sphingolipid de novo biosynthesis,Reactome,reactome,,,,['Sphingolipid de novo biosynthesis'],ok,
R-HSA-428157,R-HSA-428157,128388,R-HSA-428157,Sphingolipid metabolism,Reactome,reactome,,,,['Sphingolipid metabolism'],ok,
R-HSA-1295596,R-HSA-1295596,128389,R-HSA-1295596,Spry regulation of FGF signaling,Reactome,reactome,,,,['Spry regulation of FGF signaling'],ok,
R-HSA-69541,R-HSA-69541,128390,R-HSA-69541,Stabilization of p53,Reactome,reactome,,,,['Stabilization of p53'],ok,
R-HSA-211994,R-HSA-211994,128391,R-HSA-211994,Sterols are 12-hydroxylated by CYP8B1,Reactome,reactome,,,,['Sterols are 12-hydroxylated by CYP8B1'],ok,
R-HSA-211736,R-HSA-211736,128392,R-HSA-211736,Stimulation of the cell death response by PAK-2p34,Reactome,reactome,,,,['Stimulation of the cell death response by PAK-2p34'],ok,
R-HSA-2672351,R-HSA-2672351,128393,R-HSA-2672351,Stimuli-sensing channels,Reactome,reactome,,,,['Stimuli-sensing channels'],ok,
R-HSA-9913635,R-HSA-9913635,128394,R-HSA-9913635,Strand-asynchronous mitochondrial DNA replication,Reactome,reactome,,,,['Strand-asynchronous mitochondrial DNA replication'],ok,
R-HSA-390522,R-HSA-390522,128395,R-HSA-390522,Striated Muscle Contraction,Reactome,reactome,,,,['Striated Muscle Contraction'],ok,
R-HSA-1614517,R-HSA-1614517,128396,R-HSA-1614517,Sulfide oxidation to sulfate,Reactome,reactome,,,,['Sulfide oxidation to sulfate'],ok,
R-HSA-1614635,R-HSA-1614635,128397,R-HSA-1614635,Sulfur amino acid metabolism,Reactome,reactome,,,,['Sulfur amino acid metabolism'],ok,
R-HSA-9669934,R-HSA-9669934,128398,R-HSA-9669934,Sunitinib-resistant KIT mutants,Reactome,reactome,,,,['Sunitinib-resistant KIT mutants'],ok,
R-HSA-9674401,R-HSA-9674401,128399,R-HSA-9674401,Sunitinib-resistant PDGFR mutants,Reactome,reactome,,,,['Sunitinib-resistant PDGFR mutants'],ok,
R-HSA-9635465,R-HSA-9635465,128400,R-HSA-9635465,Suppression of apoptosis,Reactome,reactome,,,,['Suppression of apoptosis'],ok,
R-HSA-9636569,R-HSA-9636569,128401,R-HSA-9636569,Suppression of autophagy,Reactome,reactome,,,,['Suppression of autophagy'],ok,
R-HSA-9637687,R-HSA-9637687,128402,R-HSA-9637687,Suppression of phagosomal maturation,Reactome,reactome,,,,['Suppression of phagosomal maturation'],ok,
R-HSA-5683826,R-HSA-5683826,128403,R-HSA-5683826,Surfactant metabolism,Reactome,reactome,,,,['Surfactant metabolism'],ok,
R-HSA-69052,R-HSA-69052,128404,R-HSA-69052,Switching of origins to a post-replicative state,Reactome,reactome,,,,['Switching of origins to a post-replicative state'],ok,
R-HSA-8849932,R-HSA-8849932,128405,R-HSA-8849932,Synaptic adhesion-like molecules,Reactome,reactome,,,,['Synaptic adhesion-like molecules'],ok,
R-HSA-3000170,R-HSA-3000170,128406,R-HSA-3000170,Syndecan interactions,Reactome,reactome,,,,['Syndecan interactions'],ok,
R-HSA-174495,R-HSA-174495,128407,R-HSA-174495,"Synthesis And Processing Of GAG, GAGPOL Polyproteins",Reactome,reactome,,,,"['Synthesis And Processing Of GAG, GAGPOL Polyproteins']",ok,
R-HSA-171286,R-HSA-171286,128408,R-HSA-171286,Synthesis and processing of ENV and VPU,Reactome,reactome,,,,['Synthesis and processing of ENV and VPU'],ok,
R-HSA-2142816,R-HSA-2142816,128409,R-HSA-2142816,Synthesis of (16-20)-hydroxyeicosatetraenoic acids (HETE),Reactome,reactome,,,,['Synthesis of (16-20)-hydroxyeicosatetraenoic acids (HETE)'],ok,
R-HSA-2142712,R-HSA-2142712,128410,R-HSA-2142712,Synthesis of 12-eicosatetraenoic acid derivatives,Reactome,reactome,,,,['Synthesis of 12-eicosatetraenoic acid derivatives'],ok,
R-HSA-2142770,R-HSA-2142770,128411,R-HSA-2142770,Synthesis of 15-eicosatetraenoic acid derivatives,Reactome,reactome,,,,['Synthesis of 15-eicosatetraenoic acid derivatives'],ok,
R-HSA-2142688,R-HSA-2142688,128412,R-HSA-2142688,Synthesis of 5-eicosatetraenoic acids,Reactome,reactome,,,,['Synthesis of 5-eicosatetraenoic acids'],ok,
R-HSA-1483171,R-HSA-1483171,128413,R-HSA-1483171,Synthesis of BMP,Reactome,reactome,,,,['Synthesis of BMP'],ok,
R-HSA-1483076,R-HSA-1483076,128414,R-HSA-1483076,Synthesis of CL,Reactome,reactome,,,,['Synthesis of CL'],ok,
R-HSA-69239,R-HSA-69239,128415,R-HSA-69239,Synthesis of DNA,Reactome,reactome,,,,['Synthesis of DNA'],ok,
R-HSA-446205,R-HSA-446205,128416,R-HSA-446205,Synthesis of GDP-mannose,Reactome,reactome,,,,['Synthesis of GDP-mannose'],ok,
R-HSA-2142696,R-HSA-2142696,128417,R-HSA-2142696,Synthesis of Hepoxilins (HX) and Trioxilins (TrX),Reactome,reactome,,,,['Synthesis of Hepoxilins (HX) and Trioxilins (TrX)'],ok,
R-HSA-1855183,R-HSA-1855183,128418,R-HSA-1855183,"Synthesis of IP2, IP, and Ins in the cytosol",Reactome,reactome,,,,"['Synthesis of IP2, IP, and Ins in the cytosol']",ok,
R-HSA-1855204,R-HSA-1855204,128419,R-HSA-1855204,Synthesis of IP3 and IP4 in the cytosol,Reactome,reactome,,,,['Synthesis of IP3 and IP4 in the cytosol'],ok,
R-HSA-1855231,R-HSA-1855231,128420,R-HSA-1855231,Synthesis of IPs in the ER lumen,Reactome,reactome,,,,['Synthesis of IPs in the ER lumen'],ok,
R-HSA-1855191,R-HSA-1855191,128421,R-HSA-1855191,Synthesis of IPs in the nucleus,Reactome,reactome,,,,['Synthesis of IPs in the nucleus'],ok,
R-HSA-77111,R-HSA-77111,128422,R-HSA-77111,Synthesis of Ketone Bodies,Reactome,reactome,,,,['Synthesis of Ketone Bodies'],ok,
R-HSA-2142691,R-HSA-2142691,128423,R-HSA-2142691,Synthesis of Leukotrienes (LT) and Eoxins (EX),Reactome,reactome,,,,['Synthesis of Leukotrienes (LT) and Eoxins (EX)'],ok,
